<?xml version="1.0" encoding="UTF-8" standalone="no"?>
<!DOCTYPE restaurants SYSTEM "restaurants.dtd">
<restaurants>
    <restaurant id="r1">
        <coordonnees>
            <nom>Le Gourmet</nom>
            <adresse>123 Rue de Paris, Dakar</adresse>
            <restaurateur>Jean Dupont</restaurateur>
            <description>
                <paragraphes>Un restaurant offrant une cuisine française exquise.</paragraphes>
                <paragraphes>
                    <image url="https://example.com/image1.jpg" position="gauche" />
                </paragraphes>
                <paragraphes>
                    <liste>
                        <item>Ambiance chaleureuse</item>
                        <item>Service rapide</item>
                    </liste>
                </paragraphes>
                <paragraphes>
                    <important>Ne manquez pas nos desserts maison !</important>
                </paragraphes>
            </description>
        </coordonnees>
        <carte>
            <plat id="p1">
                <nom>Salade de chèvre chaud</nom>
                <type>Entrée</type>
                <prix devise="XOF">5000</prix>
                <platDescription>Une délicieuse salade avec du fromage de chèvre chaud.</platDescription>
            </plat>
            <plat id="p2">
                <nom>Boeuf bourguignon</nom>
                <type>Plat</type>
                <prix devise="XOF">12000</prix>
                <platDescription>Un classique de la cuisine française.</platDescription>
            </plat>
        </carte>
        <menus>
            <menu>
                <titre>Menu Dégustation</titre>
                <menuDescription>Un menu complet pour découvrir nos spécialités.</menuDescription>
                <prix devise="XOF">20000</prix>
                <element plat="p1" />
                <element plat="p2" />
            </menu>
        </menus>
    </restaurant>
</restaurants>